familymart,convenience_store,FAMILYMART @62502 Putrajaya,"LG-72, Lower Ground Floor, IOI City Tower Two, Lebuh IRC, IOI Resort City, 62502 Putrajaya, Sepang, Selangor",2.969659,101.712434,62502 Putrajaya,"['A-Saloon', 'NYX Professional Makeup', 'Clarks']"
familymart,convenience_store,FAMILYMART @Jalan Diplomatik,"No. 58, Jalan Diplomatik, Presint 15, 62000 Putrajaya.",2.945499,101.723673,Jalan Diplomatik,"['Mesra Pet Shop', 'Klinik Mediviron Diplomatik', 'POTO Travel & Tours Putrajaya']"
familymart,convenience_store,FAMILYMART @Persiaran Perdana,"Ground Floor, Retail F&B 3, Menara Ikhlas, No. 17, Persiaran Perdana, Presint 3, 62100 Putrajaya",2.919004,101.686816,Persiaran Perdana,"['Jabatan Imigresen Malaysia (Bahagian Passport)', 'Jabatan Imigresen Malaysia', 'Menara Ikhlas']"
familymart,convenience_store,FAMILYMART @Jalan Alamanda,"Lot G03-G04, Alamanda Shopping Centre, Jalan Alamanda, Precinct 1, 62000 Putrajaya",2.939636,101.710657,Jalan Alamanda,"['Good2u', 'M.A.C', 'GUESS']"
familymart,convenience_store,FAMILYMART @IOI Resort,"Lot LG218, IOI City Tower Two Lebuh IRC, IOI Resort, 62502 Putrajaya, Selangor",2.969223971101217,101.71133080989023,IOI Resort,"['Kakatoo Ioi City Mall', 'Black Canyon', 'Noodle Station']"
familymart,convenience_store,FAMILYMART @Jalan Pintasan Dengkil-Putrajaya (FT29) Arah Utara,"PT 3353, KM48.7, Jalan Pintasan Dengkil-Putrajaya (FT29) Arah Utara, 43800 Dengkil, Selangor Darul Ehsan",2.8691616363515164,101.68522350689427,Jalan Pintasan Dengkil-Putrajaya (FT29) Arah Utara,"['Tasik Bukit Unggul', 'Restoran Dengkil Seafood', 'ENEOS Car Service Centre']"
